{
  "$schema": "https://json-schema.org/draft/2020-12/schema",
  "$id": "https://proact.local/contracts/policies/reconciliation_tolerance.schema.json",
  "title": "Reconciliation tolerance policy",
  "description": "How large a signed plan-ledger residual may be at submission and how it is closed. Spec ACC09 (tolerance default 0 with epsilon 1e-6; site policy may approve percent or absolute; residual always stored; within-tolerance residual becomes a labelled `tolerance_adjustment` line; zero target allows absolute tolerance only) and ACC10 (positive residual beyond tolerance needs an explanation or an explicitly allowed `Unaccounted` classification). Decision D06. Consumed by sub-phase 2.8 on `submit`; versions recorded on every calculation run (2.5).",
  "type": "object",
  "required": ["policyKind", "version", "effectiveFrom", "scope", "body"],
  "additionalProperties": false,
  "properties": {
    "policyKind": { "type": "string", "const": "reconciliation_tolerance" },
    "version": { "$ref": "policy-envelope.schema.json#/$defs/version" },
    "effectiveFrom": { "$ref": "policy-envelope.schema.json#/$defs/effectiveFrom" },
    "effectiveTo": { "$ref": "policy-envelope.schema.json#/$defs/effectiveTo" },
    "scope": { "$ref": "policy-envelope.schema.json#/$defs/scope" },
    "notes": { "$ref": "policy-envelope.schema.json#/$defs/notes" },
    "body": { "$ref": "#/$defs/body" }
  },
  "$defs": {
    "body": {
      "type": "object",
      "required": ["mode", "value", "epsilon", "allowUnaccountedClassification"],
      "additionalProperties": false,
      "properties": {
        "mode": {
          "type": "string",
          "enum": ["zero", "percent", "absolute"],
          "default": "zero",
          "description": "`zero`: any |residual| > epsilon blocks submission. `percent`: tolerance = value % of the slice target (meaningless when target = 0, so the engine falls back to zero tolerance there per ACC09). `absolute`: tolerance = value in the slice unit of measure."
        },
        "value": {
          "type": "number",
          "minimum": 0,
          "default": 0,
          "description": "Tolerance magnitude. Percentage points for `percent` (0.1 = 0.1 %), quantity in the slice UoM for `absolute`, must be 0 for `zero`."
        },
        "epsilon": {
          "type": "number",
          "exclusiveMinimum": 0,
          "maximum": 0.001,
          "default": 0.000001,
          "description": "Decimal comparison epsilon: |residual| <= epsilon is treated as exactly zero (ACC09). Not a tolerance; never creates an adjustment line."
        },
        "allowUnaccountedClassification": {
          "type": "boolean",
          "default": false,
          "description": "When true a positive residual beyond tolerance may be closed with an explicit `unaccounted_classified` line that the approver accepts (ACC10). Off by default (D06)."
        },
        "unaccountedTargetOfShortfall": {
          "type": ["number", "null"],
          "minimum": 0,
          "maximum": 1,
          "default": 0.02,
          "description": "SME R7 (14 Oct 2026): improvement target for unexplained loss (positive residual, tolerance adjustments and classified Unaccounted lines) as a share of the shortfall (plan - actual). Reporting only, never the approval tolerance; absent or null = no target."
        },
        "submitGate": {
          "type": "object",
          "required": ["mode", "codedRatioTarget"],
          "additionalProperties": false,
          "description": "SME D12 (15 Oct 2026): before a shift period is submitted every stop needs a specific reason or 'investigation pending' and the coded share of stopped time (coded_downtime_ratio) must reach codedRatioTarget. `warn` shows the result on the period page, `block` refuses the submission (422 CODING_INCOMPLETE). Absent = warn at 0.95.",
          "properties": {
            "mode": { "type": "string", "enum": ["block", "warn"], "default": "warn" },
            "codedRatioTarget": { "type": "number", "minimum": 0, "maximum": 1, "default": 0.95 }
          }
        },
        "dayGate": {
          "type": "object",
          "required": ["mode", "codedRatioTarget"],
          "additionalProperties": false,
          "description": "SME D12 daily target (15 Oct 2026): before a production day is certified every stop of the day needs a specific reason or 'investigation pending' and the coded share of the day's stopped time (coded_downtime_ratio of the approved shift runs, summed) must reach codedRatioTarget. `warn` shows the result on the production day, `block` refuses the certification (422 CODING_INCOMPLETE). Absent = warn at 0.99.",
          "properties": {
            "mode": { "type": "string", "enum": ["block", "warn"], "default": "warn" },
            "codedRatioTarget": { "type": "number", "minimum": 0, "maximum": 1, "default": 0.99 }
          }
        },
        "bridgeLimits": {
          "type": "object",
          "required": ["absolute", "relative", "overLimit"],
          "additionalProperties": false,
          "description": "SME R8 (15 Oct 2026): per-unit bridge limits (null = no limit). A bridge line above `absolute` (slice unit of measure) or `relative` x the slice plan target needs a second independent reviewer before approval (`second_review`) or is refused at save (`refuse`). Absent = no limit.",
          "properties": {
            "absolute": { "type": ["number", "null"], "minimum": 0 },
            "relative": { "type": ["number", "null"], "minimum": 0 },
            "overLimit": { "type": "string", "enum": ["second_review", "refuse"], "default": "second_review" },
            "uncertaintyBudgetId": { "type": ["string", "null"], "format": "uuid", "description": "SME E4: the approved uncertainty budget of the unit whose expanded uncertainty justifies the absolute limit (shown with the findings); absolute must be set." }
          }
        },
        "reversibleKinds": {
          "type": "array",
          "uniqueItems": true,
          "description": "SME R9 (15 Oct 2026): loss kinds an evidence-backed `reversal` line may reverse (an approved line of an earlier period of the unit). Absent = every kind listed here.",
          "items": { "type": "string", "enum": ["availability", "performance", "quality", "transition_allowance", "transition_excess", "gain", "bridge", "unaccounted_classified"] }
        },
        "uncertaintyBudgetId": {
          "type": ["string", "null"],
          "format": "uuid",
          "description": "SME E4 (15 Oct 2026): the approved uncertainty budget (`uncertainty_budgets`) whose expanded uncertainty justifies an `absolute` tolerance; shown as the justification. Written only by an explicit adoption (`POST /v2/uncertainty-budgets/{id}/adopt-as-tolerance`), never automatically; absent = no stated justification."
        }
      },
      "allOf": [
        {
          "if": { "properties": { "mode": { "const": "zero" } } },
          "then": { "properties": { "value": { "type": "number", "const": 0 } } }
        },
        {
          "if": { "properties": { "mode": { "const": "percent" } } },
          "then": { "properties": { "value": { "type": "number", "maximum": 100 } } }
        }
      ]
    }
  }
}
