{
  "policyKind": "reconciliation_tolerance",
  "version": 1,
  "effectiveFrom": "1970-01-01T00:00:00Z",
  "effectiveTo": null,
  "scope": { "tenantId": "00000000-0000-0000-0000-000000000000", "siteId": null, "unitId": null },
  "notes": "Seed default recorded 2026-10-07 from D06 ('based on proposed and standard'): tolerance zero, epsilon 1e-6, no Unaccounted classification. scope.tenantId is a placeholder that the seeder replaces with the real tenant id; effectiveFrom is the epoch sentinel so every historical period resolves to this version.",
  "body": {
    "mode": "zero",
    "value": 0,
    "epsilon": 0.000001,
    "allowUnaccountedClassification": false,
    "unaccountedTargetOfShortfall": 0.02
  }
}
